No.     Time           Source                Destination           Protocol Length Info
      1 0.000000       74.203.22.229         230.211.187.172       TCP      74     49683 → 80 [SYN] Seq=0 Win=5840 Len=0 MSS=1460 SACK_PERM=1 TSval=3548665666 TSecr=0 WS=128

Frame 1: 74 bytes on wire (592 bits), 74 bytes captured (592 bits)
    Encapsulation type: Ethernet (1)
    Arrival Time: Jun  2, 2015 10:11:59.655051000 -04
    [Time shift for this packet: 0.000000000 seconds]
    Epoch Time: 1433254319.655051000 seconds
    [Time delta from previous captured frame: 0.000000000 seconds]
    [Time delta from previous displayed frame: 0.000000000 seconds]
    [Time since reference or first frame: 0.000000000 seconds]
    Frame Number: 1
    Frame Length: 74 bytes (592 bits)
    Capture Length: 74 bytes (592 bits)
    [Frame is marked: False]
    [Frame is ignored: False]
    [Protocols in frame: eth:ethertype:ip:tcp]
    [Coloring Rule Name: HTTP]
    [Coloring Rule String: http || tcp.port == 80 || http2]
Ethernet II, Src: HewlettP_ad:bc:fa (b4:99:ba:ad:bc:fa), Dst: Cisco_b6:69:bf (1c:df:0f:b6:69:bf)
    Destination: Cisco_b6:69:bf (1c:df:0f:b6:69:bf)
        Address: Cisco_b6:69:bf (1c:df:0f:b6:69:bf)
        .... ..0. .... .... .... .... = LG bit: Globally unique address (factory default)
        .... ...0 .... .... .... .... = IG bit: Individual address (unicast)
    Source: HewlettP_ad:bc:fa (b4:99:ba:ad:bc:fa)
        Address: HewlettP_ad:bc:fa (b4:99:ba:ad:bc:fa)
        .... ..0. .... .... .... .... = LG bit: Globally unique address (factory default)
        .... ...0 .... .... .... .... = IG bit: Individual address (unicast)
    Type: IPv4 (0x0800)
Internet Protocol Version 4, Src: 74.203.22.229, Dst: 230.211.187.172
    0100 .... = Version: 4
    .... 0101 = Header Length: 20 bytes (5)
    Differentiated Services Field: 0x00 (DSCP: CS0, ECN: Not-ECT)
        0000 00.. = Differentiated Services Codepoint: Default (0)
        .... ..00 = Explicit Congestion Notification: Not ECN-Capable Transport (0)
    Total Length: 60
    Identification: 0xec9d (60573)
    Flags: 0x40, Don't fragment
        0... .... = Reserved bit: Not set
        .1.. .... = Don't fragment: Set
        ..0. .... = More fragments: Not set
    ...0 0000 0000 0000 = Fragment Offset: 0
    Time to Live: 64
    Protocol: TCP (6)
    Header Checksum: 0x49ee [validation disabled]
    [Header checksum status: Unverified]
    Source Address: 74.203.22.229
    Destination Address: 230.211.187.172
Transmission Control Protocol, Src Port: 49683, Dst Port: 80, Seq: 0, Len: 0
    Source Port: 49683
    Destination Port: 80
    [Stream index: 0]
    [Conversation completeness: Incomplete, DATA (15)]
    [TCP Segment Len: 0]
    Sequence Number: 0    (relative sequence number)
    Sequence Number (raw): 2263792607
    [Next Sequence Number: 1    (relative sequence number)]
    Acknowledgment Number: 0
    Acknowledgment number (raw): 0
    1010 .... = Header Length: 40 bytes (10)
    Flags: 0x002 (SYN)
        000. .... .... = Reserved: Not set
        ...0 .... .... = Nonce: Not set
        .... 0... .... = Congestion Window Reduced (CWR): Not set
        .... .0.. .... = ECN-Echo: Not set
        .... ..0. .... = Urgent: Not set
        .... ...0 .... = Acknowledgment: Not set
        .... .... 0... = Push: Not set
        .... .... .0.. = Reset: Not set
        .... .... ..1. = Syn: Set
            [Expert Info (Chat/Sequence): Connection establish request (SYN): server port 80]
                [Connection establish request (SYN): server port 80]
                [Severity level: Chat]
                [Group: Sequence]
        .... .... ...0 = Fin: Not set
        [TCP Flags: ··········S·]
    Window: 5840
    [Calculated window size: 5840]
    Checksum: 0xfd06 [unverified]
    [Checksum Status: Unverified]
    Urgent Pointer: 0
    Options: (20 bytes), Maximum segment size, SACK permitted, Timestamps, No-Operation (NOP), Window scale
        TCP Option - Maximum segment size: 1460 bytes
            Kind: Maximum Segment Size (2)
            Length: 4
            MSS Value: 1460
        TCP Option - SACK permitted
            Kind: SACK Permitted (4)
            Length: 2
        TCP Option - Timestamps: TSval 3548665666, TSecr 0
            Kind: Time Stamp Option (8)
            Length: 10
            Timestamp value: 3548665666
            Timestamp echo reply: 0
        TCP Option - No-Operation (NOP)
            Kind: No-Operation (1)
        TCP Option - Window scale: 7 (multiply by 128)
            Kind: Window Scale (3)
            Length: 3
            Shift count: 7
            [Multiplier: 128]
    [Timestamps]
        [Time since first frame in this TCP stream: 0.000000000 seconds]
        [Time since previous frame in this TCP stream: 0.000000000 seconds]

No.     Time           Source                Destination           Protocol Length Info
      2 0.103347       230.211.187.172       74.203.22.229         TCP      74     80 → 49683 [SYN, ACK] Seq=0 Ack=1 Win=28960 Len=0 MSS=1380 SACK_PERM=1 TSval=1081292714 TSecr=3548665666 WS=128

Frame 2: 74 bytes on wire (592 bits), 74 bytes captured (592 bits)
    Encapsulation type: Ethernet (1)
    Arrival Time: Jun  2, 2015 10:11:59.758398000 -04
    [Time shift for this packet: 0.000000000 seconds]
    Epoch Time: 1433254319.758398000 seconds
    [Time delta from previous captured frame: 0.103347000 seconds]
    [Time delta from previous displayed frame: 0.103347000 seconds]
    [Time since reference or first frame: 0.103347000 seconds]
    Frame Number: 2
    Frame Length: 74 bytes (592 bits)
    Capture Length: 74 bytes (592 bits)
    [Frame is marked: False]
    [Frame is ignored: False]
    [Protocols in frame: eth:ethertype:ip:tcp]
    [Coloring Rule Name: HTTP]
    [Coloring Rule String: http || tcp.port == 80 || http2]
Ethernet II, Src: Cisco_b6:69:bf (1c:df:0f:b6:69:bf), Dst: HewlettP_ad:bc:fa (b4:99:ba:ad:bc:fa)
    Destination: HewlettP_ad:bc:fa (b4:99:ba:ad:bc:fa)
        Address: HewlettP_ad:bc:fa (b4:99:ba:ad:bc:fa)
        .... ..0. .... .... .... .... = LG bit: Globally unique address (factory default)
        .... ...0 .... .... .... .... = IG bit: Individual address (unicast)
    Source: Cisco_b6:69:bf (1c:df:0f:b6:69:bf)
        Address: Cisco_b6:69:bf (1c:df:0f:b6:69:bf)
        .... ..0. .... .... .... .... = LG bit: Globally unique address (factory default)
        .... ...0 .... .... .... .... = IG bit: Individual address (unicast)
    Type: IPv4 (0x0800)
Internet Protocol Version 4, Src: 230.211.187.172, Dst: 74.203.22.229
    0100 .... = Version: 4
    .... 0101 = Header Length: 20 bytes (5)
    Differentiated Services Field: 0x00 (DSCP: CS0, ECN: Not-ECT)
        0000 00.. = Differentiated Services Codepoint: Default (0)
        .... ..00 = Explicit Congestion Notification: Not ECN-Capable Transport (0)
    Total Length: 60
    Identification: 0x0000 (0)
    Flags: 0x40, Don't fragment
        0... .... = Reserved bit: Not set
        .1.. .... = Don't fragment: Set
        ..0. .... = More fragments: Not set
    ...0 0000 0000 0000 = Fragment Offset: 0
    Time to Live: 56
    Protocol: TCP (6)
    Header Checksum: 0x3e8c [validation disabled]
    [Header checksum status: Unverified]
    Source Address: 230.211.187.172
    Destination Address: 74.203.22.229
Transmission Control Protocol, Src Port: 80, Dst Port: 49683, Seq: 0, Ack: 1, Len: 0
    Source Port: 80
    Destination Port: 49683
    [Stream index: 0]
    [Conversation completeness: Incomplete, DATA (15)]
    [TCP Segment Len: 0]
    Sequence Number: 0    (relative sequence number)
    Sequence Number (raw): 3839268399
    [Next Sequence Number: 1    (relative sequence number)]
    Acknowledgment Number: 1    (relative ack number)
    Acknowledgment number (raw): 2263792608
    1010 .... = Header Length: 40 bytes (10)
    Flags: 0x012 (SYN, ACK)
        000. .... .... = Reserved: Not set
        ...0 .... .... = Nonce: Not set
        .... 0... .... = Congestion Window Reduced (CWR): Not set
        .... .0.. .... = ECN-Echo: Not set
        .... ..0. .... = Urgent: Not set
        .... ...1 .... = Acknowledgment: Set
        .... .... 0... = Push: Not set
        .... .... .0.. = Reset: Not set
        .... .... ..1. = Syn: Set
            [Expert Info (Chat/Sequence): Connection establish acknowledge (SYN+ACK): server port 80]
                [Connection establish acknowledge (SYN+ACK): server port 80]
                [Severity level: Chat]
                [Group: Sequence]
        .... .... ...0 = Fin: Not set
        [TCP Flags: ·······A··S·]
    Window: 28960
    [Calculated window size: 28960]
    Checksum: 0xafd1 [unverified]
    [Checksum Status: Unverified]
    Urgent Pointer: 0
    Options: (20 bytes), Maximum segment size, SACK permitted, Timestamps, No-Operation (NOP), Window scale
        TCP Option - Maximum segment size: 1380 bytes
            Kind: Maximum Segment Size (2)
            Length: 4
            MSS Value: 1380
        TCP Option - SACK permitted
            Kind: SACK Permitted (4)
            Length: 2
        TCP Option - Timestamps: TSval 1081292714, TSecr 3548665666
            Kind: Time Stamp Option (8)
            Length: 10
            Timestamp value: 1081292714
            Timestamp echo reply: 3548665666
        TCP Option - No-Operation (NOP)
            Kind: No-Operation (1)
        TCP Option - Window scale: 7 (multiply by 128)
            Kind: Window Scale (3)
            Length: 3
            Shift count: 7
            [Multiplier: 128]
    [Timestamps]
        [Time since first frame in this TCP stream: 0.103347000 seconds]
        [Time since previous frame in this TCP stream: 0.103347000 seconds]
    [SEQ/ACK analysis]
        [This is an ACK to the segment in frame: 1]
        [The RTT to ACK the segment was: 0.103347000 seconds]
        [iRTT: 0.103362000 seconds]

No.     Time           Source                Destination           Protocol Length Info
      3 0.103362       74.203.22.229         230.211.187.172       TCP      66     49683 → 80 [ACK] Seq=1 Ack=1 Win=5888 Len=0 TSval=3548665769 TSecr=1081292714

Frame 3: 66 bytes on wire (528 bits), 66 bytes captured (528 bits)
    Encapsulation type: Ethernet (1)
    Arrival Time: Jun  2, 2015 10:11:59.758413000 -04
    [Time shift for this packet: 0.000000000 seconds]
    Epoch Time: 1433254319.758413000 seconds
    [Time delta from previous captured frame: 0.000015000 seconds]
    [Time delta from previous displayed frame: 0.000015000 seconds]
    [Time since reference or first frame: 0.103362000 seconds]
    Frame Number: 3
    Frame Length: 66 bytes (528 bits)
    Capture Length: 66 bytes (528 bits)
    [Frame is marked: False]
    [Frame is ignored: False]
    [Protocols in frame: eth:ethertype:ip:tcp]
    [Coloring Rule Name: HTTP]
    [Coloring Rule String: http || tcp.port == 80 || http2]
Ethernet II, Src: HewlettP_ad:bc:fa (b4:99:ba:ad:bc:fa), Dst: Cisco_b6:69:bf (1c:df:0f:b6:69:bf)
    Destination: Cisco_b6:69:bf (1c:df:0f:b6:69:bf)
        Address: Cisco_b6:69:bf (1c:df:0f:b6:69:bf)
        .... ..0. .... .... .... .... = LG bit: Globally unique address (factory default)
        .... ...0 .... .... .... .... = IG bit: Individual address (unicast)
    Source: HewlettP_ad:bc:fa (b4:99:ba:ad:bc:fa)
        Address: HewlettP_ad:bc:fa (b4:99:ba:ad:bc:fa)
        .... ..0. .... .... .... .... = LG bit: Globally unique address (factory default)
        .... ...0 .... .... .... .... = IG bit: Individual address (unicast)
    Type: IPv4 (0x0800)
Internet Protocol Version 4, Src: 74.203.22.229, Dst: 230.211.187.172
    0100 .... = Version: 4
    .... 0101 = Header Length: 20 bytes (5)
    Differentiated Services Field: 0x00 (DSCP: CS0, ECN: Not-ECT)
        0000 00.. = Differentiated Services Codepoint: Default (0)
        .... ..00 = Explicit Congestion Notification: Not ECN-Capable Transport (0)
    Total Length: 52
    Identification: 0xec9e (60574)
    Flags: 0x40, Don't fragment
        0... .... = Reserved bit: Not set
        .1.. .... = Don't fragment: Set
        ..0. .... = More fragments: Not set
    ...0 0000 0000 0000 = Fragment Offset: 0
    Time to Live: 64
    Protocol: TCP (6)
    Header Checksum: 0x49f5 [validation disabled]
    [Header checksum status: Unverified]
    Source Address: 74.203.22.229
    Destination Address: 230.211.187.172
Transmission Control Protocol, Src Port: 49683, Dst Port: 80, Seq: 1, Ack: 1, Len: 0
    Source Port: 49683
    Destination Port: 80
    [Stream index: 0]
    [Conversation completeness: Incomplete, DATA (15)]
    [TCP Segment Len: 0]
    Sequence Number: 1    (relative sequence number)
    Sequence Number (raw): 2263792608
    [Next Sequence Number: 1    (relative sequence number)]
    Acknowledgment Number: 1    (relative ack number)
    Acknowledgment number (raw): 3839268400
    1000 .... = Header Length: 32 bytes (8)
    Flags: 0x010 (ACK)
        000. .... .... = Reserved: Not set
        ...0 .... .... = Nonce: Not set
        .... 0... .... = Congestion Window Reduced (CWR): Not set
        .... .0.. .... = ECN-Echo: Not set
        .... ..0. .... = Urgent: Not set
        .... ...1 .... = Acknowledgment: Set
        .... .... 0... = Push: Not set
        .... .... .0.. = Reset: Not set
        .... .... ..0. = Syn: Not set
        .... .... ...0 = Fin: Not set
        [TCP Flags: ·······A····]
    Window: 46
    [Calculated window size: 5888]
    [Window size scaling factor: 128]
    Checksum: 0x4ed9 [unverified]
    [Checksum Status: Unverified]
    Urgent Pointer: 0
    Options: (12 bytes), No-Operation (NOP), No-Operation (NOP), Timestamps
        TCP Option - No-Operation (NOP)
            Kind: No-Operation (1)
        TCP Option - No-Operation (NOP)
            Kind: No-Operation (1)
        TCP Option - Timestamps: TSval 3548665769, TSecr 1081292714
            Kind: Time Stamp Option (8)
            Length: 10
            Timestamp value: 3548665769
            Timestamp echo reply: 1081292714
    [Timestamps]
        [Time since first frame in this TCP stream: 0.103362000 seconds]
        [Time since previous frame in this TCP stream: 0.000015000 seconds]
    [SEQ/ACK analysis]
        [This is an ACK to the segment in frame: 2]
        [The RTT to ACK the segment was: 0.000015000 seconds]
        [iRTT: 0.103362000 seconds]

No.     Time           Source                Destination           Protocol Length Info
      4 0.103440       74.203.22.229         230.211.187.172       HTTP     198    GET /test/100MB.bin HTTP/1.0 

Frame 4: 198 bytes on wire (1584 bits), 198 bytes captured (1584 bits)
    Encapsulation type: Ethernet (1)
    Arrival Time: Jun  2, 2015 10:11:59.758491000 -04
    [Time shift for this packet: 0.000000000 seconds]
    Epoch Time: 1433254319.758491000 seconds
    [Time delta from previous captured frame: 0.000078000 seconds]
    [Time delta from previous displayed frame: 0.000078000 seconds]
    [Time since reference or first frame: 0.103440000 seconds]
    Frame Number: 4
    Frame Length: 198 bytes (1584 bits)
    Capture Length: 198 bytes (1584 bits)
    [Frame is marked: False]
    [Frame is ignored: False]
    [Protocols in frame: eth:ethertype:ip:tcp:http]
    [Coloring Rule Name: HTTP]
    [Coloring Rule String: http || tcp.port == 80 || http2]
Ethernet II, Src: HewlettP_ad:bc:fa (b4:99:ba:ad:bc:fa), Dst: Cisco_b6:69:bf (1c:df:0f:b6:69:bf)
    Destination: Cisco_b6:69:bf (1c:df:0f:b6:69:bf)
        Address: Cisco_b6:69:bf (1c:df:0f:b6:69:bf)
        .... ..0. .... .... .... .... = LG bit: Globally unique address (factory default)
        .... ...0 .... .... .... .... = IG bit: Individual address (unicast)
    Source: HewlettP_ad:bc:fa (b4:99:ba:ad:bc:fa)
        Address: HewlettP_ad:bc:fa (b4:99:ba:ad:bc:fa)
        .... ..0. .... .... .... .... = LG bit: Globally unique address (factory default)
        .... ...0 .... .... .... .... = IG bit: Individual address (unicast)
    Type: IPv4 (0x0800)
Internet Protocol Version 4, Src: 74.203.22.229, Dst: 230.211.187.172
    0100 .... = Version: 4
    .... 0101 = Header Length: 20 bytes (5)
    Differentiated Services Field: 0x00 (DSCP: CS0, ECN: Not-ECT)
        0000 00.. = Differentiated Services Codepoint: Default (0)
        .... ..00 = Explicit Congestion Notification: Not ECN-Capable Transport (0)
    Total Length: 184
    Identification: 0xec9f (60575)
    Flags: 0x40, Don't fragment
        0... .... = Reserved bit: Not set
        .1.. .... = Don't fragment: Set
        ..0. .... = More fragments: Not set
    ...0 0000 0000 0000 = Fragment Offset: 0
    Time to Live: 64
    Protocol: TCP (6)
    Header Checksum: 0x4970 [validation disabled]
    [Header checksum status: Unverified]
    Source Address: 74.203.22.229
    Destination Address: 230.211.187.172
Transmission Control Protocol, Src Port: 49683, Dst Port: 80, Seq: 1, Ack: 1, Len: 132
    Source Port: 49683
    Destination Port: 80
    [Stream index: 0]
    [Conversation completeness: Incomplete, DATA (15)]
    [TCP Segment Len: 132]
    Sequence Number: 1    (relative sequence number)
    Sequence Number (raw): 2263792608
    [Next Sequence Number: 133    (relative sequence number)]
    Acknowledgment Number: 1    (relative ack number)
    Acknowledgment number (raw): 3839268400
    1000 .... = Header Length: 32 bytes (8)
    Flags: 0x018 (PSH, ACK)
        000. .... .... = Reserved: Not set
        ...0 .... .... = Nonce: Not set
        .... 0... .... = Congestion Window Reduced (CWR): Not set
        .... .0.. .... = ECN-Echo: Not set
        .... ..0. .... = Urgent: Not set
        .... ...1 .... = Acknowledgment: Set
        .... .... 1... = Push: Set
        .... .... .0.. = Reset: Not set
        .... .... ..0. = Syn: Not set
        .... .... ...0 = Fin: Not set
        [TCP Flags: ·······AP···]
    Window: 46
    [Calculated window size: 5888]
    [Window size scaling factor: 128]
    Checksum: 0x90fd [unverified]
    [Checksum Status: Unverified]
    Urgent Pointer: 0
    Options: (12 bytes), No-Operation (NOP), No-Operation (NOP), Timestamps
        TCP Option - No-Operation (NOP)
            Kind: No-Operation (1)
        TCP Option - No-Operation (NOP)
            Kind: No-Operation (1)
        TCP Option - Timestamps: TSval 3548665769, TSecr 1081292714
            Kind: Time Stamp Option (8)
            Length: 10
            Timestamp value: 3548665769
            Timestamp echo reply: 1081292714
    [Timestamps]
        [Time since first frame in this TCP stream: 0.103440000 seconds]
        [Time since previous frame in this TCP stream: 0.000078000 seconds]
    [SEQ/ACK analysis]
        [iRTT: 0.103362000 seconds]
        [Bytes in flight: 132]
        [Bytes sent since last PSH flag: 132]
    TCP payload (132 bytes)
Hypertext Transfer Protocol

No.     Time           Source                Destination           Protocol Length Info
      5 0.206438       230.211.187.172       74.203.22.229         TCP      66     80 → 49683 [ACK] Seq=1 Ack=133 Win=30080 Len=0 TSval=1081292740 TSecr=3548665769

Frame 5: 66 bytes on wire (528 bits), 66 bytes captured (528 bits)
    Encapsulation type: Ethernet (1)
    Arrival Time: Jun  2, 2015 10:11:59.861489000 -04
    [Time shift for this packet: 0.000000000 seconds]
    Epoch Time: 1433254319.861489000 seconds
    [Time delta from previous captured frame: 0.102998000 seconds]
    [Time delta from previous displayed frame: 0.102998000 seconds]
    [Time since reference or first frame: 0.206438000 seconds]
    Frame Number: 5
    Frame Length: 66 bytes (528 bits)
    Capture Length: 66 bytes (528 bits)
    [Frame is marked: False]
    [Frame is ignored: False]
    [Protocols in frame: eth:ethertype:ip:tcp]
    [Coloring Rule Name: HTTP]
    [Coloring Rule String: http || tcp.port == 80 || http2]
Ethernet II, Src: Cisco_b6:69:bf (1c:df:0f:b6:69:bf), Dst: HewlettP_ad:bc:fa (b4:99:ba:ad:bc:fa)
    Destination: HewlettP_ad:bc:fa (b4:99:ba:ad:bc:fa)
        Address: HewlettP_ad:bc:fa (b4:99:ba:ad:bc:fa)
        .... ..0. .... .... .... .... = LG bit: Globally unique address (factory default)
        .... ...0 .... .... .... .... = IG bit: Individual address (unicast)
    Source: Cisco_b6:69:bf (1c:df:0f:b6:69:bf)
        Address: Cisco_b6:69:bf (1c:df:0f:b6:69:bf)
        .... ..0. .... .... .... .... = LG bit: Globally unique address (factory default)
        .... ...0 .... .... .... .... = IG bit: Individual address (unicast)
    Type: IPv4 (0x0800)
Internet Protocol Version 4, Src: 230.211.187.172, Dst: 74.203.22.229
    0100 .... = Version: 4
    .... 0101 = Header Length: 20 bytes (5)
    Differentiated Services Field: 0x00 (DSCP: CS0, ECN: Not-ECT)
        0000 00.. = Differentiated Services Codepoint: Default (0)
        .... ..00 = Explicit Congestion Notification: Not ECN-Capable Transport (0)
    Total Length: 52
    Identification: 0xc24d (49741)
    Flags: 0x40, Don't fragment
        0... .... = Reserved bit: Not set
        .1.. .... = Don't fragment: Set
        ..0. .... = More fragments: Not set
    ...0 0000 0000 0000 = Fragment Offset: 0
    Time to Live: 56
    Protocol: TCP (6)
    Header Checksum: 0x7c46 [validation disabled]
    [Header checksum status: Unverified]
    Source Address: 230.211.187.172
    Destination Address: 74.203.22.229
Transmission Control Protocol, Src Port: 80, Dst Port: 49683, Seq: 1, Ack: 133, Len: 0
    Source Port: 80
    Destination Port: 49683
    [Stream index: 0]
    [Conversation completeness: Incomplete, DATA (15)]
    [TCP Segment Len: 0]
    Sequence Number: 1    (relative sequence number)
    Sequence Number (raw): 3839268400
    [Next Sequence Number: 1    (relative sequence number)]
    Acknowledgment Number: 133    (relative ack number)
    Acknowledgment number (raw): 2263792740
    1000 .... = Header Length: 32 bytes (8)
    Flags: 0x010 (ACK)
        000. .... .... = Reserved: Not set
        ...0 .... .... = Nonce: Not set
        .... 0... .... = Congestion Window Reduced (CWR): Not set
        .... .0.. .... = ECN-Echo: Not set
        .... ..0. .... = Urgent: Not set
        .... ...1 .... = Acknowledgment: Set
        .... .... 0... = Push: Not set
        .... .... .0.. = Reset: Not set
        .... .... ..0. = Syn: Not set
        .... .... ...0 = Fin: Not set
        [TCP Flags: ·······A····]
    Window: 235
    [Calculated window size: 30080]
    [Window size scaling factor: 128]
    Checksum: 0x4d7e [unverified]
    [Checksum Status: Unverified]
    Urgent Pointer: 0
    Options: (12 bytes), No-Operation (NOP), No-Operation (NOP), Timestamps
        TCP Option - No-Operation (NOP)
            Kind: No-Operation (1)
        TCP Option - No-Operation (NOP)
            Kind: No-Operation (1)
        TCP Option - Timestamps: TSval 1081292740, TSecr 3548665769
            Kind: Time Stamp Option (8)
            Length: 10
            Timestamp value: 1081292740
            Timestamp echo reply: 3548665769
    [Timestamps]
        [Time since first frame in this TCP stream: 0.206438000 seconds]
        [Time since previous frame in this TCP stream: 0.102998000 seconds]
    [SEQ/ACK analysis]
        [This is an ACK to the segment in frame: 4]
        [The RTT to ACK the segment was: 0.102998000 seconds]
        [iRTT: 0.103362000 seconds]

No.     Time           Source                Destination           Protocol Length Info
      6 0.207304       230.211.187.172       74.203.22.229         TCP      1434   80 → 49683 [ACK] Seq=1 Ack=133 Win=30080 Len=1368 TSval=1081292740 TSecr=3548665769 [TCP segment of a reassembled PDU]

Frame 6: 1434 bytes on wire (11472 bits), 1434 bytes captured (11472 bits)
    Encapsulation type: Ethernet (1)
    Arrival Time: Jun  2, 2015 10:11:59.862355000 -04
    [Time shift for this packet: 0.000000000 seconds]
    Epoch Time: 1433254319.862355000 seconds
    [Time delta from previous captured frame: 0.000866000 seconds]
    [Time delta from previous displayed frame: 0.000866000 seconds]
    [Time since reference or first frame: 0.207304000 seconds]
    Frame Number: 6
    Frame Length: 1434 bytes (11472 bits)
    Capture Length: 1434 bytes (11472 bits)
    [Frame is marked: False]
    [Frame is ignored: False]
    [Protocols in frame: eth:ethertype:ip:tcp]
    [Coloring Rule Name: HTTP]
    [Coloring Rule String: http || tcp.port == 80 || http2]
Ethernet II, Src: Cisco_b6:69:bf (1c:df:0f:b6:69:bf), Dst: HewlettP_ad:bc:fa (b4:99:ba:ad:bc:fa)
    Destination: HewlettP_ad:bc:fa (b4:99:ba:ad:bc:fa)
        Address: HewlettP_ad:bc:fa (b4:99:ba:ad:bc:fa)
        .... ..0. .... .... .... .... = LG bit: Globally unique address (factory default)
        .... ...0 .... .... .... .... = IG bit: Individual address (unicast)
    Source: Cisco_b6:69:bf (1c:df:0f:b6:69:bf)
        Address: Cisco_b6:69:bf (1c:df:0f:b6:69:bf)
        .... ..0. .... .... .... .... = LG bit: Globally unique address (factory default)
        .... ...0 .... .... .... .... = IG bit: Individual address (unicast)
    Type: IPv4 (0x0800)
Internet Protocol Version 4, Src: 230.211.187.172, Dst: 74.203.22.229
    0100 .... = Version: 4
    .... 0101 = Header Length: 20 bytes (5)
    Differentiated Services Field: 0x00 (DSCP: CS0, ECN: Not-ECT)
        0000 00.. = Differentiated Services Codepoint: Default (0)
        .... ..00 = Explicit Congestion Notification: Not ECN-Capable Transport (0)
    Total Length: 1420
    Identification: 0xc24e (49742)
    Flags: 0x40, Don't fragment
        0... .... = Reserved bit: Not set
        .1.. .... = Don't fragment: Set
        ..0. .... = More fragments: Not set
    ...0 0000 0000 0000 = Fragment Offset: 0
    Time to Live: 56
    Protocol: TCP (6)
    Header Checksum: 0x76ed [validation disabled]
    [Header checksum status: Unverified]
    Source Address: 230.211.187.172
    Destination Address: 74.203.22.229
Transmission Control Protocol, Src Port: 80, Dst Port: 49683, Seq: 1, Ack: 133, Len: 1368
    Source Port: 80
    Destination Port: 49683
    [Stream index: 0]
    [Conversation completeness: Incomplete, DATA (15)]
    [TCP Segment Len: 1368]
    Sequence Number: 1    (relative sequence number)
    Sequence Number (raw): 3839268400
    [Next Sequence Number: 1369    (relative sequence number)]
    Acknowledgment Number: 133    (relative ack number)
    Acknowledgment number (raw): 2263792740
    1000 .... = Header Length: 32 bytes (8)
    Flags: 0x010 (ACK)
        000. .... .... = Reserved: Not set
        ...0 .... .... = Nonce: Not set
        .... 0... .... = Congestion Window Reduced (CWR): Not set
        .... .0.. .... = ECN-Echo: Not set
        .... ..0. .... = Urgent: Not set
        .... ...1 .... = Acknowledgment: Set
        .... .... 0... = Push: Not set
        .... .... .0.. = Reset: Not set
        .... .... ..0. = Syn: Not set
        .... .... ...0 = Fin: Not set
        [TCP Flags: ·······A····]
    Window: 235
    [Calculated window size: 30080]
    [Window size scaling factor: 128]
    Checksum: 0xf414 [unverified]
    [Checksum Status: Unverified]
    Urgent Pointer: 0
    Options: (12 bytes), No-Operation (NOP), No-Operation (NOP), Timestamps
        TCP Option - No-Operation (NOP)
            Kind: No-Operation (1)
        TCP Option - No-Operation (NOP)
            Kind: No-Operation (1)
        TCP Option - Timestamps: TSval 1081292740, TSecr 3548665769
            Kind: Time Stamp Option (8)
            Length: 10
            Timestamp value: 1081292740
            Timestamp echo reply: 3548665769
    [Timestamps]
        [Time since first frame in this TCP stream: 0.207304000 seconds]
        [Time since previous frame in this TCP stream: 0.000866000 seconds]
    [SEQ/ACK analysis]
        [iRTT: 0.103362000 seconds]
        [Bytes in flight: 1368]
        [Bytes sent since last PSH flag: 1368]
    TCP payload (1368 bytes)
    TCP segment data (1368 bytes)

No.     Time           Source                Destination           Protocol Length Info
      7 0.207314       74.203.22.229         230.211.187.172       TCP      66     49683 → 80 [ACK] Seq=133 Ack=1369 Win=8576 Len=0 TSval=3548665873 TSecr=1081292740

Frame 7: 66 bytes on wire (528 bits), 66 bytes captured (528 bits)
    Encapsulation type: Ethernet (1)
    Arrival Time: Jun  2, 2015 10:11:59.862365000 -04
    [Time shift for this packet: 0.000000000 seconds]
    Epoch Time: 1433254319.862365000 seconds
    [Time delta from previous captured frame: 0.000010000 seconds]
    [Time delta from previous displayed frame: 0.000010000 seconds]
    [Time since reference or first frame: 0.207314000 seconds]
    Frame Number: 7
    Frame Length: 66 bytes (528 bits)
    Capture Length: 66 bytes (528 bits)
    [Frame is marked: False]
    [Frame is ignored: False]
    [Protocols in frame: eth:ethertype:ip:tcp]
    [Coloring Rule Name: HTTP]
    [Coloring Rule String: http || tcp.port == 80 || http2]
Ethernet II, Src: HewlettP_ad:bc:fa (b4:99:ba:ad:bc:fa), Dst: Cisco_b6:69:bf (1c:df:0f:b6:69:bf)
    Destination: Cisco_b6:69:bf (1c:df:0f:b6:69:bf)
        Address: Cisco_b6:69:bf (1c:df:0f:b6:69:bf)
        .... ..0. .... .... .... .... = LG bit: Globally unique address (factory default)
        .... ...0 .... .... .... .... = IG bit: Individual address (unicast)
    Source: HewlettP_ad:bc:fa (b4:99:ba:ad:bc:fa)
        Address: HewlettP_ad:bc:fa (b4:99:ba:ad:bc:fa)
        .... ..0. .... .... .... .... = LG bit: Globally unique address (factory default)
        .... ...0 .... .... .... .... = IG bit: Individual address (unicast)
    Type: IPv4 (0x0800)
Internet Protocol Version 4, Src: 74.203.22.229, Dst: 230.211.187.172
    0100 .... = Version: 4
    .... 0101 = Header Length: 20 bytes (5)
    Differentiated Services Field: 0x00 (DSCP: CS0, ECN: Not-ECT)
        0000 00.. = Differentiated Services Codepoint: Default (0)
        .... ..00 = Explicit Congestion Notification: Not ECN-Capable Transport (0)
    Total Length: 52
    Identification: 0xeca0 (60576)
    Flags: 0x40, Don't fragment
        0... .... = Reserved bit: Not set
        .1.. .... = Don't fragment: Set
        ..0. .... = More fragments: Not set
    ...0 0000 0000 0000 = Fragment Offset: 0
    Time to Live: 64
    Protocol: TCP (6)
    Header Checksum: 0x49f3 [validation disabled]
    [Header checksum status: Unverified]
    Source Address: 74.203.22.229
    Destination Address: 230.211.187.172
Transmission Control Protocol, Src Port: 49683, Dst Port: 80, Seq: 133, Ack: 1369, Len: 0
    Source Port: 49683
    Destination Port: 80
    [Stream index: 0]
    [Conversation completeness: Incomplete, DATA (15)]
    [TCP Segment Len: 0]
    Sequence Number: 133    (relative sequence number)
    Sequence Number (raw): 2263792740
    [Next Sequence Number: 133    (relative sequence number)]
    Acknowledgment Number: 1369    (relative ack number)
    Acknowledgment number (raw): 3839269768
    1000 .... = Header Length: 32 bytes (8)
    Flags: 0x010 (ACK)
        000. .... .... = Reserved: Not set
        ...0 .... .... = Nonce: Not set
        .... 0... .... = Congestion Window Reduced (CWR): Not set
        .... .0.. .... = ECN-Echo: Not set
        .... ..0. .... = Urgent: Not set
        .... ...1 .... = Acknowledgment: Set
        .... .... 0... = Push: Not set
        .... .... .0.. = Reset: Not set
        .... .... ..0. = Syn: Not set
        .... .... ...0 = Fin: Not set
        [TCP Flags: ·······A····]
    Window: 67
    [Calculated window size: 8576]
    [Window size scaling factor: 128]
    Checksum: 0x4866 [unverified]
    [Checksum Status: Unverified]
    Urgent Pointer: 0
    Options: (12 bytes), No-Operation (NOP), No-Operation (NOP), Timestamps
        TCP Option - No-Operation (NOP)
            Kind: No-Operation (1)
        TCP Option - No-Operation (NOP)
            Kind: No-Operation (1)
        TCP Option - Timestamps: TSval 3548665873, TSecr 1081292740
            Kind: Time Stamp Option (8)
            Length: 10
            Timestamp value: 3548665873
            Timestamp echo reply: 1081292740
    [Timestamps]
        [Time since first frame in this TCP stream: 0.207314000 seconds]
        [Time since previous frame in this TCP stream: 0.000010000 seconds]
    [SEQ/ACK analysis]
        [This is an ACK to the segment in frame: 6]
        [The RTT to ACK the segment was: 0.000010000 seconds]
        [iRTT: 0.103362000 seconds]

No.     Time           Source                Destination           Protocol Length Info
      8 0.207416       230.211.187.172       74.203.22.229         TCP      1434   80 → 49683 [ACK] Seq=1369 Ack=133 Win=30080 Len=1368 TSval=1081292740 TSecr=3548665769 [TCP segment of a reassembled PDU]

Frame 8: 1434 bytes on wire (11472 bits), 1434 bytes captured (11472 bits)
    Encapsulation type: Ethernet (1)
    Arrival Time: Jun  2, 2015 10:11:59.862467000 -04
    [Time shift for this packet: 0.000000000 seconds]
    Epoch Time: 1433254319.862467000 seconds
    [Time delta from previous captured frame: 0.000102000 seconds]
    [Time delta from previous displayed frame: 0.000102000 seconds]
    [Time since reference or first frame: 0.207416000 seconds]
    Frame Number: 8
    Frame Length: 1434 bytes (11472 bits)
    Capture Length: 1434 bytes (11472 bits)
    [Frame is marked: False]
    [Frame is ignored: False]
    [Protocols in frame: eth:ethertype:ip:tcp]
    [Coloring Rule Name: HTTP]
    [Coloring Rule String: http || tcp.port == 80 || http2]
Ethernet II, Src: Cisco_b6:69:bf (1c:df:0f:b6:69:bf), Dst: HewlettP_ad:bc:fa (b4:99:ba:ad:bc:fa)
    Destination: HewlettP_ad:bc:fa (b4:99:ba:ad:bc:fa)
        Address: HewlettP_ad:bc:fa (b4:99:ba:ad:bc:fa)
        .... ..0. .... .... .... .... = LG bit: Globally unique address (factory default)
        .... ...0 .... .... .... .... = IG bit: Individual address (unicast)
    Source: Cisco_b6:69:bf (1c:df:0f:b6:69:bf)
        Address: Cisco_b6:69:bf (1c:df:0f:b6:69:bf)
        .... ..0. .... .... .... .... = LG bit: Globally unique address (factory default)
        .... ...0 .... .... .... .... = IG bit: Individual address (unicast)
    Type: IPv4 (0x0800)
Internet Protocol Version 4, Src: 230.211.187.172, Dst: 74.203.22.229
    0100 .... = Version: 4
    .... 0101 = Header Length: 20 bytes (5)
    Differentiated Services Field: 0x00 (DSCP: CS0, ECN: Not-ECT)
        0000 00.. = Differentiated Services Codepoint: Default (0)
        .... ..00 = Explicit Congestion Notification: Not ECN-Capable Transport (0)
    Total Length: 1420
    Identification: 0xc24f (49743)
    Flags: 0x40, Don't fragment
        0... .... = Reserved bit: Not set
        .1.. .... = Don't fragment: Set
        ..0. .... = More fragments: Not set
    ...0 0000 0000 0000 = Fragment Offset: 0
    Time to Live: 56
    Protocol: TCP (6)
    Header Checksum: 0x76ec [validation disabled]
    [Header checksum status: Unverified]
    Source Address: 230.211.187.172
    Destination Address: 74.203.22.229
Transmission Control Protocol, Src Port: 80, Dst Port: 49683, Seq: 1369, Ack: 133, Len: 1368
    Source Port: 80
    Destination Port: 49683
    [Stream index: 0]
    [Conversation completeness: Incomplete, DATA (15)]
    [TCP Segment Len: 1368]
    Sequence Number: 1369    (relative sequence number)
    Sequence Number (raw): 3839269768
    [Next Sequence Number: 2737    (relative sequence number)]
    Acknowledgment Number: 133    (relative ack number)
    Acknowledgment number (raw): 2263792740
    1000 .... = Header Length: 32 bytes (8)
    Flags: 0x010 (ACK)
        000. .... .... = Reserved: Not set
        ...0 .... .... = Nonce: Not set
        .... 0... .... = Congestion Window Reduced (CWR): Not set
        .... .0.. .... = ECN-Echo: Not set
        .... ..0. .... = Urgent: Not set
        .... ...1 .... = Acknowledgment: Set
        .... .... 0... = Push: Not set
        .... .... .0.. = Reset: Not set
        .... .... ..0. = Syn: Not set
        .... .... ...0 = Fin: Not set
        [TCP Flags: ·······A····]
    Window: 235
    [Calculated window size: 30080]
    [Window size scaling factor: 128]
    Checksum: 0xff57 [unverified]
    [Checksum Status: Unverified]
    Urgent Pointer: 0
    Options: (12 bytes), No-Operation (NOP), No-Operation (NOP), Timestamps
        TCP Option - No-Operation (NOP)
            Kind: No-Operation (1)
        TCP Option - No-Operation (NOP)
            Kind: No-Operation (1)
        TCP Option - Timestamps: TSval 1081292740, TSecr 3548665769
            Kind: Time Stamp Option (8)
            Length: 10
            Timestamp value: 1081292740
            Timestamp echo reply: 3548665769
    [Timestamps]
        [Time since first frame in this TCP stream: 0.207416000 seconds]
        [Time since previous frame in this TCP stream: 0.000102000 seconds]
    [SEQ/ACK analysis]
        [iRTT: 0.103362000 seconds]
        [Bytes in flight: 1368]
        [Bytes sent since last PSH flag: 2736]
    TCP payload (1368 bytes)
    TCP segment data (1368 bytes)

No.     Time           Source                Destination           Protocol Length Info
      9 0.207426       74.203.22.229         230.211.187.172       TCP      66     49683 → 80 [ACK] Seq=133 Ack=2737 Win=11392 Len=0 TSval=3548665873 TSecr=1081292740

Frame 9: 66 bytes on wire (528 bits), 66 bytes captured (528 bits)
    Encapsulation type: Ethernet (1)
    Arrival Time: Jun  2, 2015 10:11:59.862477000 -04
    [Time shift for this packet: 0.000000000 seconds]
    Epoch Time: 1433254319.862477000 seconds
    [Time delta from previous captured frame: 0.000010000 seconds]
    [Time delta from previous displayed frame: 0.000010000 seconds]
    [Time since reference or first frame: 0.207426000 seconds]
    Frame Number: 9
    Frame Length: 66 bytes (528 bits)
    Capture Length: 66 bytes (528 bits)
    [Frame is marked: False]
    [Frame is ignored: False]
    [Protocols in frame: eth:ethertype:ip:tcp]
    [Coloring Rule Name: HTTP]
    [Coloring Rule String: http || tcp.port == 80 || http2]
Ethernet II, Src: HewlettP_ad:bc:fa (b4:99:ba:ad:bc:fa), Dst: Cisco_b6:69:bf (1c:df:0f:b6:69:bf)
    Destination: Cisco_b6:69:bf (1c:df:0f:b6:69:bf)
        Address: Cisco_b6:69:bf (1c:df:0f:b6:69:bf)
        .... ..0. .... .... .... .... = LG bit: Globally unique address (factory default)
        .... ...0 .... .... .... .... = IG bit: Individual address (unicast)
    Source: HewlettP_ad:bc:fa (b4:99:ba:ad:bc:fa)
        Address: HewlettP_ad:bc:fa (b4:99:ba:ad:bc:fa)
        .... ..0. .... .... .... .... = LG bit: Globally unique address (factory default)
        .... ...0 .... .... .... .... = IG bit: Individual address (unicast)
    Type: IPv4 (0x0800)
Internet Protocol Version 4, Src: 74.203.22.229, Dst: 230.211.187.172
    0100 .... = Version: 4
    .... 0101 = Header Length: 20 bytes (5)
    Differentiated Services Field: 0x00 (DSCP: CS0, ECN: Not-ECT)
        0000 00.. = Differentiated Services Codepoint: Default (0)
        .... ..00 = Explicit Congestion Notification: Not ECN-Capable Transport (0)
    Total Length: 52
    Identification: 0xeca1 (60577)
    Flags: 0x40, Don't fragment
        0... .... = Reserved bit: Not set
        .1.. .... = Don't fragment: Set
        ..0. .... = More fragments: Not set
    ...0 0000 0000 0000 = Fragment Offset: 0
    Time to Live: 64
    Protocol: TCP (6)
    Header Checksum: 0x49f2 [validation disabled]
    [Header checksum status: Unverified]
    Source Address: 74.203.22.229
    Destination Address: 230.211.187.172
Transmission Control Protocol, Src Port: 49683, Dst Port: 80, Seq: 133, Ack: 2737, Len: 0
    Source Port: 49683
    Destination Port: 80
    [Stream index: 0]
    [Conversation completeness: Incomplete, DATA (15)]
    [TCP Segment Len: 0]
    Sequence Number: 133    (relative sequence number)
    Sequence Number (raw): 2263792740
    [Next Sequence Number: 133    (relative sequence number)]
    Acknowledgment Number: 2737    (relative ack number)
    Acknowledgment number (raw): 3839271136
    1000 .... = Header Length: 32 bytes (8)
